{
  "error": [],
  "success": "/used-bikes/honda-cg-125-deluxe-2022-for-sale-in-lahore-208822",
  "ad_listing_id": 2787872,
  "ad_id": 208822,
  "ad_listing": {
    "ad_id": 208822,
    "city_name": "Lahore",
    "city_area": "DHA Defence",
    "seller_comments": "This is a test ad",
    "price": "199997",
    "title": "Honda CG 125 Deluxe",
    "url_slug": "/used-bikes/honda-cg-125-deluxe-2022-for-sale-in-lahore-208822",
    "pictures_count": 1,
    "pictures": [
      {
        "picture_id": 20165260,
        "picture_thumbnail": "https://core.static2.pakkey.com/ad_pictures/2016/tn_honda-cg-125-2-2022-20165260.webp",
        "picture_medium": "https://core.static1.pakkey.com/ad_pictures/2016/Slide_honda-cg-125-2-2022-20165260.webp",
        "picture_original": "https://core.static2.pakkey.com/ad_pictures/2016/honda-cg-125-2-2022-20165260.webp",
        "picture_title": "Honda CG 125 Deluxe 2022 for Sale",
        "picture_alt": "Honda CG 125 Deluxe 2022 for Sale"
      }
    ],
    "user": {
      "id": 1710789,
      "display_name": "Test",
      "mobile_verified": true
    },
    "make": "Honda",
    "model": "CG 125 Deluxe",
    "model_year": 2022,
    "engine_type": "4-stroke",
    "disc_break": true,
    "allow_whatsapp": true,
    "phone": "03601234567"
  }
}
